{
  "$schema": "https://json-schema.org/draft/2020-12/schema",
  "$id": "https://evals.intentsolutions.io/gate-result/v1.schema.json",
  "title": "gate-result/v1 — NORMATIVE in-toto predicate body",
  "description": "Predicate body of an in-toto Statement v1 whose predicateType is https://evals.intentsolutions.io/gate-result/v1. Source of truth: Blueprint B § 7.4 (lines 794-834). The ONLY predicate body fully spec-bound at v1; every other predicate URI runs in sigstore_staging until its SPEC.md normative section lands per DR-010 Q3. This schema validates ONLY the predicate body — the enclosing in-toto Statement envelope (_type, subject, predicateType) is validated separately. Each row independently verifiable; NO top-level bundle signature per § 7 line 754. Adding/loosening any field requires Class-1 ISEDC convening.\n\nMigration note: this schema SUPERSEDES the lab's v0.1.0-draft schema (which used `result`/`timestamp` and was missing gate_name/gate_version/gate_reasons/coverage/policy_ref). Blueprint B § 7.4 is the canonical source — the lab schema was authored before Blueprint B landed on main.",
  "type": "object",
  "additionalProperties": false,
  "required": [
    "gate_id",
    "gate_name",
    "gate_version",
    "gate_decision",
    "gate_reasons",
    "coverage",
    "policy_ref",
    "policy_hash",
    "input_hash",
    "evaluated_at",
    "runner",
    "commit_sha"
  ],
  "properties": {
    "gate_id": {
      "$ref": "https://github.com/jeremylongshore/intent-eval-core/schemas/v1/_common.schema.json#/$defs/subjectName",
      "description": "Pipeline-hop-qualified gate identifier. MUST match the in-toto subject `name` per § 7.3."
    },
    "gate_name": {
      "$ref": "https://github.com/jeremylongshore/intent-eval-core/schemas/v1/_common.schema.json#/$defs/kebabSlug",
      "description": "Short human-readable kebab-case gate name."
    },
    "gate_version": {
      "$ref": "https://github.com/jeremylongshore/intent-eval-core/schemas/v1/_common.schema.json#/$defs/semver",
      "description": "SemVer version of the gate logic that produced this row."
    },
    "gate_decision": {
      "type": "string",
      "description": "Decision verdict (Blueprint B § 7.4 line 800, closed 4-element enum). Distinct from JudgeVerdict (UPPERCASE) and RolloutGateDecision (ship/no_ship).",
      "enum": ["pass", "fail", "advisory", "error"]
    },
    "gate_reasons": {
      "type": "array",
      "description": "Structured reason strings. Empty array permitted ONLY for unconditional pass. For fail/advisory/error, at least one entry MUST appear; for error, gate_reasons[0] MUST capture the error class per § 7.4 line 829.",
      "items": { "type": "string" }
    },
    "coverage": {
      "$ref": "https://github.com/jeremylongshore/intent-eval-core/schemas/v1/_common.schema.json#/$defs/coverage"
    },
    "policy_ref": {
      "type": "string",
      "description": "Format: `sha256:<hex>:<repo-relative-path>`. Defends against mid-flight policy mutation per § 7.4 line 810.",
      "pattern": "^sha256:[a-f0-9]{64}:.+$"
    },
    "policy_hash": {
      "$ref": "https://github.com/jeremylongshore/intent-eval-core/schemas/v1/_common.schema.json#/$defs/sha256Prefixed",
      "description": "sha256-prefixed hash of the policy file content."
    },
    "input_hash": {
      "$ref": "https://github.com/jeremylongshore/intent-eval-core/schemas/v1/_common.schema.json#/$defs/sha256Prefixed",
      "description": "sha256-prefixed hash of the input the gate evaluated. MUST equal the in-toto subject[].digest.sha256 for the row per § 7.4 line 814 + § 7.3 line 792."
    },
    "evaluated_at": {
      "$ref": "https://github.com/jeremylongshore/intent-eval-core/schemas/v1/_common.schema.json#/$defs/rfc3339"
    },
    "runner": {
      "$ref": "https://github.com/jeremylongshore/intent-eval-core/schemas/v1/_common.schema.json#/$defs/runnerIdentifier"
    },
    "commit_sha": {
      "$ref": "https://github.com/jeremylongshore/intent-eval-core/schemas/v1/_common.schema.json#/$defs/commitSha"
    },
    "metadata": {
      "type": "object",
      "description": "Tool-specific free-form metadata. Consumers MUST NOT use this for ship/no-ship decisions per § 7.4 line 818.",
      "additionalProperties": true
    },
    "failure_mode": {
      "type": "string",
      "description": "Failure-mode classifier. MUST be populated when gate_decision='fail' AND the originating tool defines failure modes (e.g., MM-class for audit-harness gates)."
    },
    "advisory_severity": {
      "type": "string",
      "description": "Severity hint when gate_decision='advisory'. Consumer policy decides whether to elevate to blocking.",
      "enum": ["info", "warn", "error"]
    },
    "cost_record_ref": {
      "$ref": "https://github.com/jeremylongshore/intent-eval-core/schemas/v1/_common.schema.json#/$defs/uuidv7",
      "description": "FK → CostRecord.id for cost attribution."
    },
    "replay_fidelity_level": {
      "type": "string",
      "description": "Replay fidelity level per iel-E11.",
      "enum": ["RF-0", "RF-1", "RF-2", "RF-3", "RF-4"]
    }
  },
  "allOf": [
    {
      "description": "When gate_decision='advisory', advisory_severity SHOULD be populated.",
      "if": {
        "properties": { "gate_decision": { "const": "advisory" } },
        "required": ["gate_decision"]
      },
      "then": { "required": ["advisory_severity"] }
    }
  ]
}
